{
  "topic": "Test Topic",
  "total_duration": 10,
  "style_profile": {
    "visualization_style": {
      "primary": "flowchart_animation",
      "secondary": [
        "2d_explainer"
      ]
    },
    "color_palette": {
      "primary": "#2E86DE",
      "secondary": "#5F27CD",
      "background": "#FFFFFF",
      "text": "#2C3E50",
      "accent": "#FF6B6B"
    },
    "animation": {
      "transition_speed": "smooth"
    }
  },
  "scenes": [
    {
      "scene_id": 1,
      "start_time": 0,
      "duration": 10,
      "narration": "This shows a client connecting to a server",
      "visual_description": "Client and server boxes with arrow",
      "elements": [
        {
          "element_id": "title_text",
          "type": "text",
          "label": "This shows a client connecting to a server",
          "position": {
            "x": 0,
            "y": 3
          },
          "color": "#2C3E50"
        },
        {
          "element_id": "elem_0",
          "type": "box",
          "label": "Client",
          "position": {
            "x": -3,
            "y": 0
          },
          "color": "#2E86DE",
          "size": {
            "width": 2,
            "height": 1.5
          }
        },
        {
          "element_id": "elem_1",
          "type": "box",
          "label": "Server",
          "position": {
            "x": 3,
            "y": 0
          },
          "color": "#2E86DE",
          "size": {
            "width": 2,
            "height": 1.5
          }
        },
        {
          "element_id": "elem_2",
          "type": "arrow",
          "label": "Arrow",
          "position": {
            "x": 0,
            "y": 1
          },
          "color": "#FF6B6B"
        }
      ],
      "animations": [
        {
          "element_id": "title_text",
          "animation_type": "fade_in",
          "timing": {
            "start": 0.0,
            "duration": 0.5
          },
          "parameters": {}
        },
        {
          "element_id": "elem_0",
          "animation_type": "fade_in",
          "timing": {
            "start": 0.3,
            "duration": 0.5
          },
          "parameters": {}
        },
        {
          "element_id": "elem_1",
          "animation_type": "fade_in",
          "timing": {
            "start": 0.6,
            "duration": 0.5
          },
          "parameters": {}
        },
        {
          "element_id": "elem_2",
          "animation_type": "fade_in",
          "timing": {
            "start": 0.8999999999999999,
            "duration": 0.5
          },
          "parameters": {}
        },
        {
          "element_id": "elem_2",
          "animation_type": "grow",
          "timing": {
            "start": 1.0999999999999999,
            "duration": 0.6
          },
          "parameters": {
            "direction": "horizontal"
          }
        }
      ],
      "transitions": {
        "type": "fade",
        "duration": 0.5
      }
    }
  ]
}